Name,Email,Mobile,Country Code,Company,City,State,Country,Lead Owner,Status,Notes,Data Source,Possession Time,Description,Created At
Chris Anderson,chris.anderson@example.com,9876543222,+91,Anderson Group,Mumbai,Maharashtra,India,sales@groweasy.com,GOOD_LEAD_FOLLOW_UP,Interested in CRM for 100 agents. Need enterprise features,leads_on_demand,2027-06-30,Manufacturing company with multiple locations,2026-07-11 17:30:00
Jennifer Lee,jennifer.lee@example.com,9876543223,+91,Lee Enterprises,Singapore,,,Singapore,sales@groweasy.com,SALE_DONE,Deal closed for $100,000. Implementation starts next month,meridian_tower,2027-03-15,Singapore-based trading company,2026-07-11 18:00:00
Mark Wilson,mark.wilson@example.com,9876543224,+44,Wilson & Co,London,England,UK,sales@groweasy.com,DID_NOT_CONNECT,Tried contacting multiple times. No response. Wrong number?,eden_park,,UK consulting firm,2026-07-11 08:45:00
Sarah Miller,sarah.miller@example.com,9876543225,+1,Miller Corp,New York,NY,USA,sales@groweasy.com,GOOD_LEAD_FOLLOW_UP,Looking for CRM with mobile app. Very responsive,varah_swamy,2027-09-01,US retail chain with 50 stores,2026-07-11 19:15:00
David Thompson,david.thompson@example.com,9876543226,+61,Thompson Tech,Sydney,NSW,Australia,sales@groweasy.com,BAD_LEAD,Went with local competitor. Price was main concern,sarjapur_plots,,Australian software company,2026-07-11 09:30:00
Lisa Johnson,lisa.johnson@example.com,9876543227,+33,Johnson Solutions,Paris,,France,sales@groweasy.com,GOOD_LEAD_FOLLOW_UP,Need French language support. Discussing with team,leads_on_demand,2027-05-20,French marketing agency,2026-07-11 20:00:00
